{
  "$schema": "http://json-schema.org/draft-07/schema#",
  "type": "array",
  "items": {
    "type": "object",
    "required": ["id", "name", "type", "description", "source_url", "stars", "category", "tags", "tech_stack", "install", "source", "last_synced"],
    "properties": {
      "id": { "type": "string", "pattern": "^[a-z0-9-]+$" },
      "name": { "type": "string" },
      "type": { "type": "string", "enum": ["mcp", "skill", "rule", "prompt"] },
      "description": { "type": "string" },
      "source_url": { "type": "string", "format": "uri" },
      "stars": { "type": ["integer", "null"] },
      "pushed_at": { "type": ["string", "null"], "description": "ISO 8601 timestamp of last repo push" },
      "added_at": { "type": "string", "format": "date", "description": "Date when an MCP or Skill entry first joined the catalog" },
      "evaluation": {
        "type": "object",
        "properties": {
          "coding_relevance": { "type": ["integer", "null"], "minimum": 1, "maximum": 5 },
          "doc_completeness": { "type": ["integer", "null"], "minimum": 1, "maximum": 5 },
          "desc_accuracy": { "type": ["integer", "null"], "minimum": 1, "maximum": 5 },
          "writing_quality": { "type": ["integer", "null"], "minimum": 1, "maximum": 5 },
          "specificity": { "type": ["integer", "null"], "minimum": 1, "maximum": 5 },
          "install_clarity": { "type": ["integer", "null"], "minimum": 1, "maximum": 5 },
          "final_score": { "type": ["number", "null"], "minimum": 0, "maximum": 100 },
          "decision": { "type": ["string", "null"], "enum": ["accept", "review", "reject", null] },
          "model_id": { "type": ["string", "null"], "description": "LLM model name or '__cached__'" },
          "rubric_version": { "type": ["string", "null"] },
          "evaluated_at": { "type": ["string", "null"], "description": "ISO 8601 timestamp of evaluation" }
        }
      },
      "category": { "type": "string", "enum": ["frontend", "backend", "fullstack", "mobile", "devops", "database", "testing", "security", "ai-ml", "tooling", "documentation"] },
      "tags": { "type": "array", "items": { "type": "string" } },
      "tech_stack": { "type": "array", "items": { "type": "string" } },
      "install": {
        "type": "object",
        "required": ["method"],
        "properties": {
          "method": { "type": "string", "enum": ["mcp_config", "mcp_config_template", "manual", "git_clone", "download_file"] },
          "config": { "type": "object" },
          "placeholder_hints": {
            "type": "object",
            "description": "Map of placeholder name to user-friendly description, e.g. {\"PATH_TO_API_DOT_JSON\": \"TypeDoc generated API JSON file path\"}",
            "additionalProperties": { "type": "string" }
          },
          "target_dir": { "type": "string" },
          "files": { "type": "array", "items": { "type": "string" } },
          "repo": { "type": "string" },
          "branch": { "type": "string", "description": "Optional branch name for git_clone skill installs that extract a skill from a specific branch" },
          "path": { "type": "string", "description": "Optional repository path for git_clone skill installs that extract a single skill directory" }
        }
      },
      "health": {
        "type": "object",
        "description": "Composite health score and signals",
        "properties": {
          "score": { "type": "integer", "minimum": 0, "maximum": 100 },
          "signals": {
            "type": "object",
            "properties": {
              "freshness": { "type": "number", "minimum": 0, "maximum": 100 },
              "popularity": { "type": "number", "minimum": 0, "maximum": 100 },
              "source_trust": { "type": "number", "minimum": 0, "maximum": 100 }
            }
          },
          "freshness_label": { "type": "string", "enum": ["active", "stale", "abandoned"] },
          "last_commit": { "type": ["string", "null"] }
        }
      },
      "source": { "type": "string" },
      "last_synced": { "type": "string", "format": "date" },
      "install_count": {
        "type": "integer",
        "minimum": 0,
        "description": "skills.sh 累计安装次数；仅 skills.sh 数据源会写入，optional"
      },
      "skills_sh_url": {
        "type": "string",
        "format": "uri",
        "description": "skills.sh 上对应 skill 的权威落点 URL；optional"
      },
      "skills_sh_scraped_at": {
        "type": "string",
        "pattern": "^\\d{4}-\\d{2}-\\d{2}T\\d{2}:\\d{2}:\\d{2}(\\.\\d+)?Z$",
        "description": "skills.sh 数据抓取时间，ISO 8601 (e.g. 2026-01-30T04:51:07Z 或 .907Z)；optional"
      },
      "mcp_registry_status": {
        "type": "string",
        "enum": ["active", "inactive", "deprecated"],
        "description": "MCP 官方 registry status；仅 mcp_registry 数据源会写入，optional"
      },
      "mcp_registry_published_at": {
        "type": "string",
        "pattern": "^(\\d{4}-\\d{2}-\\d{2}T\\d{2}:\\d{2}:\\d{2}(\\.\\d+)?Z|)$",
        "description": "MCP registry 收录时间，ISO 8601 或空串（registry 未提供 publishedAt 时占位）；optional"
      },
      "mcp_remotes": {
        "type": "array",
        "description": "MCP server remote endpoints（含 type 与 url）；optional",
        "items": {
          "type": "object",
          "required": ["type", "url"],
          "properties": {
            "type": { "type": "string" },
            "url": { "type": "string", "format": "uri" }
          }
        }
      }
    }
  }
}
