[
  {
    "id": "playwright-mcp",
    "name": "Playwright MCP",
    "type": "mcp",
    "description": "Browser automation via Playwright accessibility snapshots for LLMs",
    "source_url": "https://github.com/microsoft/playwright-mcp",
    "stars": 8800,
    "category": "testing",
    "tags": [
      "browser",
      "automation",
      "e2e",
      "testing"
    ],
    "tech_stack": [
      "typescript"
    ],
    "install": {
      "method": "mcp_config",
      "config": {
        "command": "npx",
        "args": [
          "@playwright/mcp@latest"
        ]
      }
    },
    "source": "curated",
    "added_at": "2026-03-25",
    "last_synced": "2026-03-25"
  },
  {
    "id": "github-mcp",
    "name": "GitHub MCP Server",
    "type": "mcp",
    "description": "GitHub API integration for repository management, issues, PRs, and code search",
    "source_url": "https://github.com/github/github-mcp-server",
    "stars": 5000,
    "category": "tooling",
    "tags": [
      "github",
      "git",
      "version-control",
      "api"
    ],
    "tech_stack": [
      "go"
    ],
    "install": {
      "method": "mcp_config",
      "config": {
        "command": "npx",
        "args": [
          "@anthropic/github-mcp-server"
        ]
      }
    },
    "source": "curated",
    "added_at": "2026-03-25",
    "last_synced": "2026-03-25"
  },
  {
    "id": "anthropic-cookbook",
    "name": "claude-cookbooks",
    "type": "mcp",
    "description": "A collection of notebooks/recipes showcasing some fun and effective ways of using Claude.",
    "source_url": "https://github.com/anthropics/anthropic-cookbook",
    "stars": 36650,
    "category": "ai-ml",
    "tags": [],
    "tech_stack": [
      "jupyter notebook",
      "python",
      "shell",
      "makefile",
      "dockerfile"
    ],
    "install": {
      "method": "mcp_config",
      "config": {
        "command": "npx",
        "args": [
          "@anthropics/anthropic-cookbook"
        ]
      }
    },
    "source": "curated",
    "added_at": "2026-03-30",
    "last_synced": "2026-03-30",
    "pushed_at": "2026-03-27T20:04:07Z"
  }
]
